{
  "id": "v1-5-1",
  "version": "1.5.1",
  "name": "Architext 1.5.1 Audit Remediation",
  "status": "implementing",
  "posture": "on-track",
  "summary": "Architext 1.5.1 finishes the audit-remediation sweep and separates package-owned viewer source from target-owned architecture data.",
  "targetDate": "2026-05-27",
  "lastUpdated": "2026-05-27T15:30:00.000Z",
  "updateSource": "1.5.1 remediation planning",
  "scope": {
    "required": [
      {
        "id": "package-source-target-split",
        "title": "Package source and target data split",
        "kind": "architecture",
        "status": "complete",
        "summary": "Move package-owned viewer source, schemas, validator, and Vite project out of docs/architext so sync cleanup cannot collide with Architext's own source tree.",
        "priority": "high",
        "source": "ad-hoc",
        "dateAdded": "2026-05-27T15:30:00.000Z",
        "workstreamId": "source-target-boundaries",
        "dependsOn": [],
        "evidence": [
          "docs/architecture/PACKAGE_SOURCE_TARGET_DATA_SPLIT.md",
          "viewer",
          "package.json",
          "src/adapters/cli/architext-cli.mjs"
        ]
      },
      {
        "id": "remaining-audit-remediation",
        "title": "Remaining audit remediation",
        "kind": "bug-fix",
        "status": "in-progress",
        "summary": "Finish unresolved high, medium, and low audit findings from the superpowers remediation plan without regressing routing, lifecycle, validation, or release workflows.",
        "priority": "high",
        "source": "ad-hoc",
        "dateAdded": "2026-05-27T15:30:00.000Z",
        "workstreamId": "audit-hardening",
        "dependsOn": [],
        "evidence": [
          "docs/superpowers/plans/2026-05-27-architext-audit-remediation.md",
          "npm test",
          "npm run verify"
        ]
      },
      {
        "id": "release-verification",
        "title": "Release verification",
        "kind": "test",
        "status": "planned",
        "summary": "Run validation, full tests, build, routing benchmark, UAT, package dry-run, and packed CLI smoke checks before release.",
        "priority": "high",
        "source": "ad-hoc",
        "dateAdded": "2026-05-27T15:30:00.000Z",
        "workstreamId": "release-gates",
        "dependsOn": [
          "package-source-target-split",
          "remaining-audit-remediation"
        ],
        "evidence": [
          "docs/architecture/RELEASE_1_5_1_SUCCESS_CRITERIA.md"
        ]
      }
    ],
    "planned": [],
    "stretch": [],
    "deferred": [],
    "outOfScope": []
  },
  "workstreams": [
    {
      "id": "source-target-boundaries",
      "name": "Source Target Boundaries",
      "owner": "maintainer",
      "status": "complete",
      "posture": "release-candidate",
      "summary": "Keep package-owned source separate from target-owned architecture data.",
      "progress": 100,
      "itemIds": [
        "package-source-target-split"
      ],
      "evidence": [
        "docs/architecture/PACKAGE_SOURCE_TARGET_DATA_SPLIT.md",
        "npm pack --dry-run --json"
      ]
    },
    {
      "id": "audit-hardening",
      "name": "Audit Hardening",
      "owner": "maintainer",
      "status": "in-progress",
      "posture": "on-track",
      "summary": "Finish remaining audit-remediation items with focused tests and behavior-preserving refactors.",
      "progress": 35,
      "itemIds": [
        "remaining-audit-remediation"
      ],
      "evidence": [
        "docs/superpowers/plans/2026-05-27-architext-audit-remediation.md"
      ]
    },
    {
      "id": "release-gates",
      "name": "Release Gates",
      "owner": "maintainer",
      "status": "planned",
      "posture": "on-track",
      "summary": "Prove the package remains buildable, shippable, and usable after the audit sweep.",
      "progress": 0,
      "itemIds": [
        "release-verification"
      ],
      "evidence": [
        "docs/architecture/RELEASE_1_5_1_SUCCESS_CRITERIA.md"
      ]
    }
  ],
  "blockers": [],
  "milestones": [
    {
      "id": "boundaries-complete",
      "label": "Boundaries complete",
      "status": "complete",
      "targetWindow": "1.5.1 remediation",
      "order": 1,
      "itemIds": [
        "package-source-target-split"
      ]
    },
    {
      "id": "remediation-complete",
      "label": "Remediation complete",
      "status": "in-progress",
      "targetWindow": "1.5.1 remediation",
      "order": 2,
      "itemIds": [
        "remaining-audit-remediation"
      ]
    },
    {
      "id": "release-ready",
      "label": "Release ready",
      "status": "planned",
      "targetWindow": "1.5.1 release",
      "order": 3,
      "itemIds": [
        "release-verification"
      ]
    }
  ],
  "dependencies": [],
  "evidence": [
    {
      "id": "release-1-5-1-success-criteria",
      "label": "1.5.1 success criteria",
      "href": "docs/architecture/RELEASE_1_5_1_SUCCESS_CRITERIA.md",
      "kind": "document",
      "status": "complete"
    },
    {
      "id": "superpowers-audit-plan",
      "label": "Superpowers audit remediation plan",
      "href": "docs/superpowers/plans/2026-05-27-architext-audit-remediation.md",
      "kind": "document",
      "status": "in-progress"
    }
  ]
}

